SV,Estrategia de I+D+i,"Existe una Estrategia de Investigación, Desarrollo e Innovación (I+D+i) en la que se espera que se incluya alguna mención específica al acceso abierto a contenidos científicos.",https://www.innovacion.gob.sv/innovacion.php,,"0101,0102,0604",Producción científica,Datos abiertos de investigación,,,,,,,,,,,,,,,,,,,,,X,,,,0101,0102,,,,,,,,,,,,,,,,,,,,,0604,,
SV,Política Nacional de Popularización de la Ciencia y Tecnología,Se ha desarrollado una Política Nacional de Popularización de la Ciencia y Tecnología con el objetivo de divulgar la ciencia en todos los niveles de la sociedad.,https://www.transparencia.gob.sv/institutions/capres/documents/372512/download,,"0102,0103,0201,0301,0302,0303,0304,0403,0501,0604",,Datos abiertos de investigación,Recursos Educativos Abiertos,,,Ciencia ciudadana,,,,Pueblos indígenas,Investigadores marginados,Comunidades locales ,Virtuales,,,,Investigación abierta y reproducible,Cuerpos Normativos Nacionales ,,,,,X,,,,,0102,0103,,,0201,,,,0301,0302,0303,0304,,,,0403,0501,,,,,0604,,
SV,LA Referencia,"Este país ha generado recientemente iniciativas dirigidas al desarrollo de repositorios digitales, constituyendo un gran avance la creación del Consorcio de Bibliotecas Universitarias de El Salvador - CBUES -, el cual reúne a las bibliotecas de nueve universidades salvadoreñas y a la Biblioteca Nacional con el fin de estimular el tema de Acceso Abierto en forma colectiva.

",https://www.lareferencia.info/es/nodos/el-salvador,cbues.org.sv,"0102,0103,0201,0304,0403,0602,0604,0606",,Datos abiertos de investigación,Recursos Educativos Abiertos,,,Ciencia ciudadana,,,,,,,Virtuales,,,,Investigación abierta y reproducible,,,,X,,X,,X,,,0102,0103,,,0201,,,,,,,0304,,,,0403,,,,0602,,0604,,0606
,,,,,,,,,,,,,,,,,,,,,,,,,,,,,,,,,,,,,,,,,,,,,,,,,,,,,,,,
,,,,,,,,,,,,,,,,,,,,,,,,,,,,,,,,,,,,,,,,,,,,,,,,,,,,,,,,
,Crear un entorno normativo propicio para la ciencia abierta;,,A,,,,,,,,,,,,,,,,,,,,,,,,,,,,,,,,,,,,,,,,,,,,,,,,,,,,,
,Invertir en infraestructuras y servicios de ciencia abierta;,,B,,,,,,,,,,,,,,,,,,,,,,,,,,,,,,,,,,,,,,,,,,,,,,,,,,,,,
,"Invertir en recursos humanos, formación, educación, alfabetización digital y desarrollo de capacidades para la ciencia abierta;",,C,,,,,,,,,,,,,,,,,,,,,,,,,,,,,,,,,,,,,,,,,,,,,,,,,,,,,
,Fomentar una cultura de la ciencia abierta y armonizar los incentivos en favor de la ciencia abierta;,,D,,,,,,,,,,,,,,,,,,,,,,,,,,,,,,,,,,,,,,,,,,,,,,,,,,,,,
,"promover la cooperación internacional y multipartita en el contexto de la ciencia abierta y con miras a reducir las brechas digital, tecnológica y de conocimientos.",,E,,,,,,,,,,,,,,,,,,,,,,,,,,,,,,,,,,,,,,,,,,,,,,,,,,,,,
,Otros,,F,,,,,,,,,,,,,,,,,,,,,,,,,,,,,,,,,,,,,,,,,,,,,,,,,,,,,